{
  "$schema": "http://json-schema.org/draft-07/schema#",
  "$id": "nx-claude/claude-plugin.schema.json",
  "title": "Claude plugin manifest (.claude-plugin/plugin.json)",
  "type": "object",
  "required": ["name", "version"],
  "additionalProperties": true,
  "properties": {
    "name": {
      "type": "string",
      "minLength": 1,
      "maxLength": 64,
      "pattern": "^[a-z0-9-]+$",
      "description": "Lowercase letters, numbers and hyphens only."
    },
    "version": {
      "type": "string",
      "pattern": "^[0-9]+\\.[0-9]+\\.[0-9]+(?:-[0-9A-Za-z.-]+)?(?:\\+[0-9A-Za-z.-]+)?$",
      "description": "Semantic version, e.g. 1.2.3."
    },
    "description": { "type": "string", "minLength": 1, "maxLength": 1024 },
    "dependencies": {
      "type": "array",
      "description": "Other Claude plugins this plugin depends on: a plugin name, or { name, version } with a semver range.",
      "items": {
        "oneOf": [
          { "type": "string", "minLength": 1, "maxLength": 64, "pattern": "^[a-z0-9-]+$" },
          {
            "type": "object",
            "required": ["name"],
            "additionalProperties": true,
            "properties": {
              "name": {
                "type": "string",
                "minLength": 1,
                "maxLength": 64,
                "pattern": "^[a-z0-9-]+$"
              },
              "version": { "type": "string", "minLength": 1 }
            }
          }
        ]
      }
    },
    "keywords": { "type": "array", "items": { "type": "string" } },
    "repository": { "type": "string", "minLength": 1 },
    "license": { "type": "string" },
    "author": {
      "description": "Claude Code rejects string authors — must be an object with at least `name`.",
      "type": "object",
      "required": ["name"],
      "additionalProperties": true,
      "properties": {
        "name": { "type": "string" },
        "email": { "type": "string" },
        "url": { "type": "string" }
      }
    }
  }
}
